{
  "date": "2026-09-13",
  "repo": "vllm-project/vllm-ascend",
  "branch": "main",
  "commits": [
    {
      "sha": "660c4582aa580ce98edc9b681bb6ff6d03153575",
      "author": {
        "name": "LQDLove",
        "email": "34787704+LQDLove@users.noreply.github.com"
      },
      "date": "2026-09-13T16:02:30+08:00",
      "message": "[BugFix] Precast MoE gate weight_fp32 to avoid aclop Cast (#16189)\n\n### What this PR does / why we need it?\n\nNightly `qwen3-vl-235b-a22b-instruct-w8a8` (A3, `FULL_DECODE_ONLY`\nACLGraph) fails because internal-router MoE recomputes logits with:\n\n`gate.weight.to(torch.float32)`\n\nThat emits a per-forward `aclop Cast`. DeepSeek-V4 and 310P already\navoid this by setting `gate.precast_fp32_weight = True` so\n`AscendUnquantizedLinearMethod.process_weights_after_loading`\nmaterializes `weight_fp32` at load time.\n\nThis PR applies the same precast in `AscendMoERunner.__init__` for all\nAscend platforms, and routes the hot path through `_gate_weight_fp32()`\nso ACLGraph capture no longer depends on a live Cast.\n\n### Does this PR introduce _any_ user-facing change?\n\nNo.\n\n### How was this patch tested?\n\n- Code-path review against 310P `AscendMoERunner310` and DeepSeek-V4\n`precast_fp32_weight`.\n- Nightly should re-run `Qwen3-VL-235B-A22B-Instruct-W8A8`.\n\nMade with [Cursor](https://cursor.com)\n\n- vLLM main:\nhttps://github.com/vllm-project/vllm/commit/a97dacb7106ee49f39f3d1fc6ae1800ff724e01d\n\n---------\n\nSigned-off-by: LQD <1107297340@qq.com>\nSigned-off-by: liaoqidan <1107297340@qq.com>\nCo-authored-by: Cursor <cursoragent@cursor.com>",
      "parents": [
        "d4d2957e5208c2f464d4625c05920bd29ea233cb"
      ],
      "stats": {
        "total_additions": 245,
        "total_deletions": 28,
        "files_changed": 6
      },
      "files": [
        {
          "filename": "tests/ut/ops/test_fused_moe.py",
          "status": "modified",
          "additions": 175,
          "deletions": 0,
          "patch": "@@ -1798,3 +1798,178 @@ def test_forward_impl_keeps_full_width_input_for_shared_experts(monkeypatch):\n     }\n     assert result[0] is shared_out\n     assert result[1] is routed_out\n+\n+\n+def _stub_moe_runner_init(monkeypatch, *, gate=None, shared_experts=None):\n+    \"\"\"Construct AscendMoERunner with a lightweight MoERunner.__init__ stub.\"\"\"\n+    moe_config = SimpleNamespace(hidden_dim=4, ep_size=1)\n+    routed_experts = SimpleNamespace(\n+        quant_type=QuantType.NONE,\n+        quant_method=object(),\n+        return_with_event=False,\n+        router=None,\n+    )\n+\n+    def init_base_runner(\n+        runner,\n+        layer_name,\n+        config,\n+        _router,\n+        experts,\n+        _enable_dbo,\n+        gate_arg,\n+        shared_experts_arg,\n+        _shared_expert_gate,\n+        routed_input_transform,\n+        routed_output_transform,\n+        routed_scaling_factor,\n+    ):\n+        nn.Module.__init__(runner)\n+        runner.layer_name = layer_name\n+        runner.moe_config = config\n+        runner.routed_experts = experts\n+        runner._shared_experts = shared_experts_arg\n+        runner._gate = gate_arg\n+        runner.gate = gate_arg\n+        runner.routed_input_transform = routed_input_transform\n+        runner.routed_output_transform = routed_output_transform\n+        runner.routed_scaling_factor = routed_scaling_factor\n+        runner._forward_entry = object()\n+\n+    monkeypatch.setattr(fused_moe_module.MoERunner, \"__init__\", init_base_runner)\n+    monkeypatch.setattr(fused_moe_module, \"AscendSharedExperts\", MagicMock(return_value=SimpleNamespace()))\n+    monkeypatch.setattr(fused_moe_module, \"get_tp_group\", MagicMock(return_value=object()))\n+    monkeypatch.setattr(fused_moe_module, \"get_dp_group\", MagicMock(return_value=object()))\n+    monkeypatch.setattr(fused_moe_module, \"setup_moe_comm_method\", MagicMock())\n+    monkeypatch.setattr(fused_moe_module, \"get_moe_comm_method\", MagicMock(return_value=None))\n+\n+    return AscendMoERunner(\n+        \"model.layers.0.mlp\",\n+        moe_config,\n+        router=object(),\n+        routed_experts=routed_experts,\n+        gate=gate,\n+        shared_experts=shared_experts,\n+    )\n+\n+\n+def test_runner_sets_precast_fp32_weight(monkeypatch):\n+    \"\"\"Init sets precast so load materializes weight_fp32.\"\"\"\n+    gate = SimpleNamespace(weight=torch.randn(8, 4, dtype=torch.float16))\n+    runner = _stub_moe_runner_init(monkeypatch, gate=gate)\n+\n+    assert runner._gate is gate\n+    assert gate.precast_fp32_weight is True\n+    assert not hasattr(gate, \"weight_fp32\")\n+\n+\n+def test_runner_skips_precast_when_weight_fp32_already_exists(monkeypatch):\n+    gate = SimpleNamespace(weight_fp32=torch.randn(8, 4, dtype=torch.float32))\n+    runner = _stub_moe_runner_init(monkeypatch, gate=gate)\n+\n+    assert runner._gate is gate\n+    assert not hasattr(gate, \"precast_fp32_weight\")\n+\n+\n+def test_runner_skips_precast_without_internal_router(monkeypatch):\n+    runner = _stub_moe_runner_init(monkeypatch, gate=None)\n+    assert runner._gate is None\n+\n+\n+def test_forward_impl_uses_gate_weight_fp32(monkeypatch):\n+    \"\"\"Hot path only reads gate.weight_fp32; judgment lives in __init__.\"\"\"\n+    runner = AscendMoERunner.__new__(AscendMoERunner)\n+    nn.Module.__init__(runner)\n+    hidden_states = torch.randn(2, 4, dtype=torch.float16)\n+    # FP16 router_logits forces the path that uses hidden_states.float() + gate weight.\n+    router_logits = torch.randn(2, 3, dtype=torch.float16)\n+    weight_fp32 = torch.randn(3, 4, dtype=torch.float32)\n+    weight = MagicMock()\n+    weight.to = MagicMock(side_effect=AssertionError(\"forward must not Cast gate.weight\"))\n+    gate = SimpleNamespace(weight=weight, weight_fp32=weight_fp32)\n+    routed_out = torch.randn(2, 4)\n+    recomputed_logits = torch.randn(2, 3, dtype=torch.float32)\n+\n+    def fake_linear(x, w):\n+        assert w is weight_fp32\n+        assert x.dtype == torch.float32\n+        return recomputed_logits\n+\n+    runner._gate = gate\n+    runner.gate = gate\n+    runner.ascend_shared_experts = None\n+    runner.routed_experts = SimpleNamespace(forward_impl=MagicMock(return_value=routed_out))\n+    runner._sequence_parallel_context = MagicMock(return_value=nullcontext())\n+    monkeypatch.setattr(fused_moe_module.F, \"linear\", fake_linear)\n+\n+    result = runner._forward_impl(\n+        hidden_states,\n+        router_logits,\n+        shared_experts_input=None,\n+        input_ids=None,\n+    )\n+\n+    assert result is routed_out\n+    weight.to.assert_not_called()\n+    runner.routed_experts.forward_impl.assert_called_once_with(\n+        hidden_states=hidden_states,\n+        router_logits=recomputed_logits,\n+        input_ids=None,\n+    )\n+\n+\n+def test_forward_impl_shared_experts_uses_gate_weight_fp32(monkeypatch):\n+    runner = AscendMoERunner.__new__(AscendMoERunner)\n+    nn.Module.__init__(runner)\n+    hidden_states = torch.randn(2, 4, dtype=torch.float16)\n+    router_logits = torch.randn(2, 3, dtype=torch.float16)\n+    weight_fp32 = torch.randn(3, 4, dtype=torch.float32)\n+    weight = MagicMock()\n+    weight.to = MagicMock(side_effect=AssertionError(\"forward must not Cast gate.weight\"))\n+    gate = SimpleNamespace(weight=weight, weight_fp32=weight_fp32)\n+    routed_out = torch.randn(2, 4)\n+    shared_out = torch.randn(2, 4)\n+    recomputed_logits = torch.randn(2, 3, dtype=torch.float32)\n+    routed_events = FusedMoEEvents(\n+        before_routed_experts=None,\n+        after_routed_experts=None,\n+        before_dispatch=None,\n+        before_gmm2=None,\n+        before_combine=None,\n+    )\n+\n+    def fake_linear(x, w):\n+        assert w is weight_fp32\n+        assert x.dtype == torch.float32\n+        return recomputed_logits\n+\n+    runner._gate = gate\n+    runner.gate = gate\n+    runner.routed_input_transform = None\n+    runner.routed_output_transform = None\n+    runner.ascend_shared_experts = SimpleNamespace(\n+        multistream_overlap=False,\n+        parallel_mode=MagicMock(return_value=None),\n+        forward=MagicMock(return_value=shared_out),\n+    )\n+    runner.routed_experts = SimpleNamespace(forward_impl=MagicMock(return_value=(routed_out, routed_events)))\n+    runner._sequence_parallel_context = MagicMock(return_value=nullcontext())\n+    current_stream = MagicMock()\n+    monkeypatch.setattr(fused_moe_module.F, \"linear\", fake_linear)\n+    monkeypatch.setattr(fused_moe_module.torch.npu, \"current_stream\", lambda: current_stream)\n+\n+    result = runner._forward_impl(\n+        hidden_states,\n+        router_logits,\n+        shared_experts_input=None,\n+        input_ids=None,\n+    )\n+\n+    assert result == (shared_out, routed_out)\n+    weight.to.assert_not_called()\n+    runner.routed_experts.forward_impl.assert_called_once_with(\n+        hidden_states=hidden_states,\n+        router_logits=recomputed_logits,\n+        input_ids=None,\n+    )\n+    runner.ascend_shared_experts.forward.assert_called_once()"
        },
        {
          "filename": "tests/ut/ops/test_gate_linear.py",
          "status": "modified",
          "additions": 18,
          "deletions": 1,